"","ID","URL","Type","Corpus","Date","Dateline","Place","Topic","Title","Body","Notes","Snippet","Context","Summary","Sentiment"
"1","Review: 41 : Amazon Echo - Black","null",0,"Amazon Review","Tue Oct 18 00:00:00 EDT 2016","18-Oct-16","null","Amazon Echo - Black","null","I ordered Echo specifically for musicIve had a huge music library on Amazon for years But it didnt take long after installing Echo to find out that there is now an annual charge for having oversongs so only a small portion of my library is available But OKsince subscription is to be expected these days I decided to pare down my library down to fit and get Echo to play only the songs that are free But I found Alexa will not play them When I ask to play something from my music library it plays unfamiliar songs that I know are not in there If I ask for one of my playlists instead more often than not shell just start playing crappy Prime music When that happens I just keep saying Alexa next until maybetunes later it produces something I can actually tolerate Anotheror so crappy tunes and my blood pressure is rising so I figure its too much work to listen to any more music on Echo I say Alexa stop When I ask for a specific song I might get it to play because its actually in Prime Ive been a Prime shipping member since the beginning But more often I will get a pitch for the Unlimited music atper month and a short sample of the song I wanted to hear to try to upsell me to an expensive service I dont want Ive found that all of the Prime services are quite limited not only Music but Video and Books Its especially hard to find anything of any real value in Booksmostly its stupid romances and mysteries Video has a similar low ratio of classics to dreck Now Ive discovered the same problem exists in Prime Music And compared to Prime services Google Play and Google Search are a pleasure They have enough good content that I use them at work constantly I was expecting something similar for my home from Amazon But back to Echo Another battle I had with Alexa was that I assumed she could hear me at all Its quiet in my small house and my office is just down the hall from her but often I got no response to my voice commands So I figured Ill try using the Fire TV remote device to feed in my commands directly I bought Fire TV initially because of the suggestion somewhere on the web site that it would work with Echo which I planned to buy later I dont particularly like Fire TV but at least it wasnt expensive I could see from the Alexa app how to do the pairing but had no luck so I called Support After a while I was told I have to unpair it for TV and set it to work for the Echo instead so we spent about an hour trying to do that over and over without success I wouldnt mind switching pairing back and forth if it would work so I gave it my best shot Finally I got escalated to the Echo team and learned from that team member that the Fire TV remote will never work Instead I have to buy a remote that is specifically for Echo Already I wasted hours on several support calls trying to get Echo to play my music library then another hour trying to get the Fire TV remote to work and finally I learned it would cost me anotherto get Alexa to hear me if Im in my office only aboutfeet away What a waste for something that shouldnt be necessary in the first place As for troubleshooting the music library several very nice Support team members tried to help me get it to upload I first got a rep who says shed give me a day trial to verify that it would work before I subscribed So I spent a couple of days editing my copy of my library on an extended drive so I could try dragging them into Amazons Musics desktop app to upload them But then the upload from my desktop would not work Instead I got an email that the trial had already expiredin two days instead of thirty Another rep tried to get the trial going but I got another twoday expiration I do have other things to do so I wasnt working on it during those two days So again uploading my meager library did not work I even got a third expired trial but by then I was past caring Actually all of the support reps are very earnest charming polite and accommodating but they seem to have a very small knowledge base to work with There is no documentation available to them much less customers so they have to guess thats probably why it took forever to find out the Fire TV remote wouldnt work The day trials didnt work either but it made sense that there would be a way to accommodate customers who do want to give it a chance before investing heavily in the necessary upsells I guess upper management didnt think of that As noted by other Echo reviewers the bugs are apparently not yet worked out and it seems to me that the support process has apparently been defined only for gardenvariety issues I get the feeling that this product was just released too early and the customer service process was not coordinated with the release to deal with the inevitable problems customers would have with Echo I hope Amazon will learn from this review and fix these problems for others but its too late for me While going through all of these remarkable hassles I was constantly reevaluating my commitment to this device I was deciding whether to spend up tofor what is essentially just a voiceactivated speakerplusfor the subscriptionfor an additional remote But the other services are marginal at best As in the other reviews here I found that Alexa knows practically nothing Bing search engine so getting questions answered successfully is rare Alexa does set a timer and reports the weather competently but I have an iPhone so why would I care about those small conveniences All I really wanted was voiceactivated music If I ever had gotten my library in there on a trial basis Id probably have gone ahead and used it maybe even paid for a subscription though certainly not Unlimited music But Amazons trial software doesnt work yet to show me that my music library would ever work so why should I keep banging my head on the wall trying force Echo to work as advertised Recently I learned that Google is releasing a competitive device in a couple of weeks and the online review says I can easily upload my music library to it and use Google Play and Search instead Plus its going to be about half the price of Echo and considering all the upsells needed to make Echo work it seems like a nobrainer to just give up on Alexa and Echo So sorry Amazon I love youIm one of your oldest customers and have probably spent overon your site sinceBut this product has become a paperweight that I dont even try to use anymore Im sorry to say that its time to throw in the towel and just send it back","null","null",NA,"null","positive"
"2","Review: 309 : Amazon Echo - Black","null",0,"Amazon Review","Sat Jul 02 00:00:00 EDT 2016","2-Jul-16","null","Amazon Echo - Black","null","Echo is well worth the money Alexa tells jokes reports the weather local and abroad shares current events plays music you can hook her up to your iTunes account for a small fee but we decided it wasnt necessary because it was easier to connect her to our free Pandora account instead and creates a shopping list all voice activated so much more efficient than pulling out your phone and typing Set up was very easyjust download the free Amazon Alexa app and follow the instructions I didnt realize the shopping list would go directly to the app on my phone The app also keeps a running newsfeed of what youve recently asked Alexawe like this because our kids LOVE her and we can quickly glance at what they asked her in case it was inappropriate however she doesnt seem to answer inappropriate questions anyway We asked her a dirty joke and she told us a farm animal joke about mud LolWe keep in our kitchen so shes easily accessible Excellent user friendly technology","null","null",NA,"null","positive"
"3","Review: 190 : Amazon Echo - Black","null",0,"Amazon Review","Mon Mar 28 00:00:00 EDT 2016","28-Mar-16","null","Amazon Echo - Black","null","Ive had the Echo for just under a year now and Ive used a lot of features on it Its not as flawless as the commercial naturally It plays music great A simple voice command Alexa play pop music on prime and it will answer you back with an acknowledgement to your request then begin the task It takes some discipline for the kids when they hear the station they dont want not to shout out ALEXA in an attempt to sabotage your brief moment of serenity I did find that the extra features like traffic news and weather werent the best source of information It was often times difficult to actually get Alexa to tell me what I wanted to hear Im not talking about clearing the roadways Im talking about giving me the right information I enjoy the Echo because I got it for the simplicity of playing music without having to connect my music player or leave my phone docked somewhere The sound quality is very good in my opinion and the volume can get too loud for a house at levelYoud have to walk over to the Echo and turn it down by hand because Alexa wont hear you We stick to volumeor below and its served us well Id call it a great radio with a wide range of music sources We enjoy it and we recommend it","null","null",NA,"null","positive"
"4","Review: 417 : Amazon Echo - Black","null",0,"Amazon Review","Fri Feb 19 00:00:00 EST 2016","19-Feb-16","null","Amazon Echo - Black","null","I will give Echostars but I have an issue I live in Hong Kong and I know when I signed on that it was not an international product but after almost year now and still no international support Come on Amazon I am starting the InternationalAlexa hash tag","null","null",NA,"null","negative"
"5","Review: 268 : Amazon Echo - Black","null",0,"Amazon Review","Mon Apr 18 00:00:00 EDT 2016","18-Apr-16","null","Amazon Echo - Black","null","We loved Alexa but recently she has developed a personality all her own She has gotten into base jumping She did it a couple of times and was successful so I think it just went to her head I guess when you are an inanimate object with a super powered brain and you are forced to stand around all day the wind in your cracks and holes would feel invigorating and maybe even dislodge some dust Wellunfortunately she decided to try the big jump recently and we found out that Alexas unlike cats dont always land on their feet She wasnt the same after that jump I think she had a screw loose She started to flip her top Well one more short jump and Alexas lights have dimmed She is currently in a medically induced coma and I dont think anything short of a soddering iron and super glue is going to fix her Alexa just stood too tall and got knocked over too easy When she fell she almost always rolled right for those cliff faces In the future I think a squattier non rolling Alexa is going to be the right move for families with small kids Or maybe the new Alexa babies that you hook to your own speakers will be less inclined to be knocked over","null","null",NA,"null","positive"
"6","Review: 85 : Amazon Echo - Black","null",0,"Amazon Review","Sun Dec 06 00:00:00 EST 2015","6-Dec-15","null","Amazon Echo - Black","null","I have owned and used this formonths now before writing this reviewI wanted to make sure that everything I write on here remained accurate to the best of my ability Pros Unique product with a plethora of wonderful and completely unique combinations of capabilities fast response time once you learn how to ask certain things and read the instructions of each major update you find yourself using it without even thinking I even use it to dress myself occasionallylike asking for different ways to tie a bow tie since I normally wear a standard tie lol flash briefing while getting ready to go to morning meetings and business briefings is a phenomenal time saver with no strain on the eyes each update all auto updates really adds a lot of function and prime continues to add so much more functionality every month I no longer use Spotify Prime music lets me import the music I already own and use their massive library as well Which can be hilariously strange I will admit as they somehow do not have The Beatlesno I am not jokingbut they have over half of the obscure punk bands I grew up loving decades ago Alexa learns quite a lot of subtle things If I say her name in a sentence now this took a few months she will not respond unnecessarily However if I open with Alexa she will always respond I still get the occasional unwanted response from her but she has never once failed to respond when I called her I avoid so many arguments with my wife now because of Alexas shopping list function and the iOSandroid appalso the built in ToDo lists Happy wife happy life Enough said tech wise the speaker on the Echo is phenomenal It sounds better than theVizio Soundbar thats mounted to the tv in our home office The degree sound and deep bass is SO good for any genre of music You dont get any peakage or distortion no matter how heavy the bass or how high the treblealso mids are completely clear audible and articulate I could not be happier with the sound quality smart home integration is superb if you buy the other items after Echo to ensure compatibility Cons while this item has Bluetooth capabilities they have been very unnecessarily and frustratingly limited because I assume they think that following the business model of Microsoft and Mac to make frustrating proprietary crap in the worst possible ways is a smart ideaits not If I could integrate this with other Bluetooth devices aside from the phones that are running Alexa App and the Amazon Prime Music Appthis device would literally be perfect For example being able to use Bluetooth stereo headphonesmic while Im in the office or even a remote Bluetooth speaker for another room They tried with their remote to at least do SOMETHING but its always out of stock and it really should be included with the base uniteven if it makes the priceinstead ofAlso as someone who is a huge technophile does pretty much all of my computing from a terminal emulator the fact that Amazon had support for Linux with their Prime Music and other apps for so longand has now REMOVED that supportabsolutely infuriates me Open source is the future it doesnt matter how many decades the old men Gates and co try to drag their heels","null","null",NA,"null","positive"
"7","Review: 443 : Amazon Echo - Black","null",0,"Amazon Review","Sat Jan 16 00:00:00 EST 2016","16-Jan-16","null","Amazon Echo - Black","null","Alexas reading from Kindle books is wooden fast and unpleasant In most things Ive asked of Alexa I am happy pleased and even promote it to others I like the features like tell me the time or when to the Seahawks play football this week or wake me inminutes however I am a big reader and was delighted to imagine it might read my most recent book while Im doing dishes etc Tried it and stopped withinminutes She reads a bit too fast with wooden voice inflections When she sees why she assumes it is a question even if the context is not a question Yuk Not doing that ever again Ill have Audiocom read my books to me through my iPhone with ear buds Awkward with the wires but oh well much more enjoyable","null","null",NA,"null","positive"
"8","Review: 429 : Amazon Echo - Black","null",0,"Amazon Review","Tue Aug 25 00:00:00 EDT 2015","25-Aug-15","null","Amazon Echo - Black","null","Lets just start by saying that I love Echo aka Alexa This is the first step towards a fully connected home Sure for now shes great for things like playing the radio Alexa play WXPN radio news updates or for cooking timers and various alarms I rarely use the todo list feature and never user the shopping lists but who cares about those anyway I want to be able to say Alexa turn off the office lights and have her do just that and I know thats possible with some new connected wall switches Where I think the real power of this device will eventually show up is with deeper home automation Id really love to be able to do the followingAlexa Turn on the TVAlexa Mute the TVAlexa Change TV to RokuAlexa Change TV to DVDAlexa Pause the TV and have it know whether Im watching TiVo Roku or my DVD playerAlexa Water the Garden forhourAlexa Make me Dinner OK maybe thats asking too much but not after watching Humans Hopefully more app and device developers will step in to build hooks for connected devices including IR blasters so that we can really use Alexa as our the main hub in an automated home","null","null",NA,"null","positive"
"9","Review: 44 : Amazon Echo - Black","null",0,"Amazon Review","Fri Aug 14 00:00:00 EDT 2015","14-Aug-15","null","Amazon Echo - Black","null","If you regularly use Siri or Google Now you will probably not be very impressed with Echo It is simply not ready for prime time right now I will gladly change my review in time but it needs tighter integration with Search it needs to let developers add plugins for it so it can integrate with more of what is on my phone and what is on the web Too many times Alexa replies Hmmm I dont think I understand or I cant find the answer to that it becomes unreliable and moves from being a goto device So basically right now the kids ask it jokes I add things to my grocery list listen to a little music and once and a while set a timer","null","null",NA,"null","positive"
"10","Review: 438 : Amazon Echo - Black","null",0,"Amazon Review","Sat Jan 16 00:00:00 EST 2016","16-Jan-16","null","Amazon Echo - Black","null","This has amazing potential It has fine sound quality and the voice recognition isnt half bad Amazon music streaming leaves a lot to be desired and this really cant be used in the same role that manywireless speakers can be used So much potential but right now they need to open it up","null","null",NA,"null","positive"
"11","Review: 354 : Amazon Echo - Black","null",0,"Amazon Review","Mon Dec 21 00:00:00 EST 2015","21-Dec-15","null","Amazon Echo - Black","null","The Echo is fast Damn fast It can even pull up music from Pandora and iHeart Radio in less thanseconds It recognizes my voice in a near whisper fromfeet away It even finds artists and albums with a few short words Shuffling soandso by soandso Boomseconds youre listening to a new album or artist you DONT have in your prime collection I want to listen to anything Well here you go The only catch is you have to know what youre looking for If you dont get it right the Echo might ask you if youre looking for this For me I needed the ability to listen to my hundreds of albums on Google Music But guess what Anything not on your stations in Pandora iHeart Radio or on Prime Music Its a friggin Bluetooth speaker It will stream music from my phone or tablet Set the volume by asking for volumeto impressively loudVery soothing voice like a female version of Jarvis from Iron Man fluid natural speaking a pretty fun library of jokesI tried the woodchuck joke it responded funny the first time the abily to pause resume and repeat any incoming Bluetooth music Wow Why did Google not get all over this Maybe they did You know Google But it suggests a Bing search it sends to your device Its obvious who endorsed this It is the beginning of Skynet Ha ha ha It can control any WiFi device such as lights If I were to reach for a complaint far reach it doesnt have a function to shuffle your own playlists You can ask for it when music begins But Im huge on Shuffle It will instead start on the same piece every time And no ReapeatAll fuction It instead starts over the playlist when asked Maybe the functions are somewhere burried in the Alexa App The last thing I could say its very simple for some responses and no ability to follow up the previous question Overall I could not be more pleased A merry Christmas to me HelloThis is a fun start Make room Google And hello battery life on my phone and Tablet P","null","null",NA,"null","positive"
"12","Review: 299 : Amazon Echo - Black","null",0,"Amazon Review","Thu Feb 11 00:00:00 EST 2016","11-Feb-16","null","Amazon Echo - Black","null","My family and I like our echobut its so new yetI think Amazon needs to add a lot more stuff to it before I would recommend people buying itLast week or so I know they added Uber servicePizza delivery thats niceShe good for checking factsand if you spend the money for the plug insshe can turn lights on and offbut that gets kind of expensive to doI think she has potential and I know Amazon is updating her often This is wishy washy I knowbut its the best review I can do at this time","null","null",NA,"null","positive"
"13","Review: 394 : Amazon Echo - Black","null",0,"Amazon Review","Mon Apr 25 00:00:00 EDT 2016","25-Apr-16","null","Amazon Echo - Black","null","The Amazon Echo is a very good product It has the potential to eventually be a great product Anyone reading this review will likely already know about most if not all of the Echos features so I will not clutter this review with descriptions of the basic features I do want to share an observation about Echos integration with IFTTT The Amazon Alexa IFTTT library of recipes is still small Hopefully more recipes will be coming soon And as many other Echo owners have stated the current way of issuing Alexa IFTTT commands is mostly awkward For example if you want Alexa to call someones cell phone or your own there are some recipes to do that However most of those recipes work by telling Alexa to add an item to your todo list That is awkward and can create confusion for elderly users of the Echo Another somewhat annoying aspect of the Alexa IFTTT arrangement is that in order to activate an IFTTT recipes it is necessary to preface the recipe name with the command TRIGGER For example I have a recipe that I created for possible use by my elderly mom The recipe is Call Jerry it sends a saved message So for my mom to ask Alexa to call me she would need to say Alexa Trigger Call Jerry Her brain at her age does not think like that At the very least I strongly suggest that Amazon change the IFTTT activation word TRIGGER to PLEASE This will make for more natural sounding commands My previous Call Jerry example would become Alexa Please Call Jerrythat sounds very natural and probably can be remembered better by not only elderly people but everyone If the Amazon Echo is to go beyond very good to great Amazon and IFTTT would need to make it possible for more natural language statements to accomplish tasks and recipes As it stands now the Echo implements a rather limited syntax Until then I think my suggestion to use PLEASE instead of or optionally to TRIGGER would be a good interim solution","null","null",NA,"null","positive"
"14","Review: 192 : Amazon Echo - Black","null",0,"Amazon Review","Sun Nov 29 00:00:00 EST 2015","29-Nov-15","null","Amazon Echo - Black","null","See this is why I wish Amazon had half star reviews as well Because I love it But there are a few set back on it But its not a four star product nor is it astar Of course this is a new item and there are a few kinks and ripples in its operation But thats to be expected from a voice guided system I mean Siri wasnt that great when they first put it on their iPhones But now look what it can do You can ask it all sorts of questions and it will answer most of the time But sometimes it has a hard time getting an answer I know it understands me well enough because when you open up the app on your phone you can see that it clearly heard you and understood what you were saying it just didnt have the answer for you in the cloud But one thing Amazon did do right are the multicolored lights at the top of the speaker thats a REALLY cool additive They also made it wired to a power source which is a good think because if it had a battery it would probably have to betimes bigger andtimes heavier than it is now But as Amazon and its services comes up with new updates and new things to add to the features it will get way more better over time But there are a few down sides Sometimes when Im playing some music off of my phone through bluetooth it gets kinda glitchy and lags a few second every now and then Then theres the fact that when you turn the volume up too loud it will start to distort the speaker and it will sound very raspy and poor I know Amazon can fix all these things with a few software updates or building their online knowledge database But until then it afor me","null","null",NA,"null","positive"
"15","Review: 378 : Amazon Echo - Black","null",0,"Amazon Review","Wed Jul 13 00:00:00 EDT 2016","13-Jul-16","null","Amazon Echo - Black","null","Im a die hard Apple fan user and stockholder This product feels like the next big thing and Amazon just gave Apple a black eye That out of the way I love everything about this device Its sound quality is almost mind blowing and Alexa is fairly quick on the draw with answers or looking up music Like Siri shes a little rough around the edges on some subjects She had no idea who the Texas Rangers baseball team are but she knew how old Burt Reynolds is in a split second Go figure Weather forecasts and other things you might ask on a daily basis seem to be absolutely no challenge and she gives quick succinct answers The only thing lacking is any kind of visual interface so you have to ask Alexa for any information you might want like the name of a song Im actually using my iPhone and Siri to name the songs So far Siri and Alexa are getting along just fine Overall a VERY impressive device","null","null",NA,"null","positive"
