"","ID","URL","Type","Corpus","Date","Dateline","Place","Topic","Title","Body","Notes","Snippet","Context","Summary","Sentiment"
"247","Review: 436 : Amazon Echo - Black","null",0,"Amazon Review","Tue Jun 30 00:00:00 EDT 2015","30-Jun-15","null","Amazon Echo - Black","null","Does the Echo work outside of the US Yes it sure does I decided to take a risk and buy one even though I live in Australia because I think this is really cutting edge tech and from reading the reviews a very useful piece of tech Its true Theres been a few updates since initial Prime only limited release and it seems to be getting more services which is goodkeep them coming It doesnt work with certain things like saying search and sometimes itll ask you to repeat something Its a bit trial and error to see what it can and cant do But the main think with this device is that what it doesnt it does well and has quickly become a many times a day use device Feel like some music just ask play me some Jazz or play music will play your Amazon music library It works with Pandora and other such music streaming and radio services Tells you the weather tells you what traffic will be like on the way to work and more All of this works over here in Australia I have now bought some Wemo home automation devices to play with them as the Echo can interact with Wemo things and turn on and off appliances lights etc The simplicity of being able to just call out to set a timer find out what the weather will be like before heading out listen to music without having to turn things on and connect things is worth the price on its own You dont have to wait for the International release if you live outside of the US so buy and enjoy","null","null",NA,"null","positive"
"248","Review: 325 : Amazon Echo - Black","null",0,"Amazon Review","Sun Feb 07 00:00:00 EST 2016","7-Feb-16","null","Amazon Echo - Black","null","I purchased my Echo back in early November after a couple of months of talking myself into buying one or passing on it I finally gave in when one day Amazon had aoff code available to me as a Prime member which brought the price down toand same day delivery I wanted to let some time pass and give Alexa a good run before posting a review I ordered it that morning it arrived around dinnertime that evening and the story began Ive been in love with this thing since day one It is absolutely incredible and so much fun to have at my disposal The sound that comes from something that is not terribly large in size is the best part Crisp clear highs and enough bass to handle some pretty good lows I wont go so far as to say that it falls into the Bose category of sound for example but Im a bit of an audiophile and Alexa has impressed me very much in this area especially at this price point It was great being able to have any Prime playlist available on a whim and of course Pandora and TuneIn radio but in the last couple of days Spotify has joined the ranks as well which really pushed things over the top for me Let me add that you DO need to have a Premium Spotify account in order to use it via Echo which is something Ive had for close to a year now but it is well worth it and Ive used it extensively since the service was added to Echo as an option Initial setup was a snap it connected flawlessly to my wifi network and stays connected Bluetooth pairing is as simple as it gets as well and works beautifully with all devices in my home No need to Google anything just ask Alexa There are still some things she does not know the answers to but Im very confident that that will change with future updates Ive found very few questions that have stumped her thusfar It really is a truly outstanding device and I strongly recommend it","null","null",NA,"null","positive"
"249","Review: 33 : Amazon Echo - Black","null",0,"Amazon Review","Thu Jun 09 00:00:00 EDT 2016","9-Jun-16","null","Amazon Echo - Black","null","I really wanted to love the Echo but Amazon using Bing instead of Google really limits the capabilities of the Echo I would ask Echo a question which she would proceed not to know but then ask the same to Google and instantly would know","null","null",NA,"null","positive"
"250","Review: 123 : Amazon Echo - Black","null",0,"Amazon Review","Sun Apr 03 00:00:00 EDT 2016","3-Apr-16","null","Amazon Echo - Black","null","The Purpose of the Amazon Echo is to enhance any homeowners life by being your home assistant at your request by your voice At a glance The Amazon Echo is tall modern looking speaker She fits in most spaces without being an eyesore and looks pretty good The dimensions for this arebyinches or about as tall and wide assoups cans These are normally black with a matte finish on them but there are skins that can applied to them like mine that comes from slickwraps link the in description below not sponsored With a birds eye view youll seephysical buttons one to disallow her from hearing anything and the other known as the action button that can turn off an alarm wakes your echo and Enables WiFi setup mode after you press and hold it forseconds Talking about set up it is crazy easy Download the application on your iOS android or your Fire OS deviceIt is a Free Download and follow the instructions that come with your Echo and follow the guide you receive with your echo for a simple setup Alldevices for me was a simple to setup the Echo The Amazon Echo has aMicrophone array which allows it to have a fulldegree listening range to pick up your voice as easy as possible So that means you can talk to her at a normal tone for the most part She does struggles to hear you when addressing her in following environments TV being being on at a decent level of volume Crowds of people in the same room all talking at a normal level Rooms with an echo she will sometimes hear your voice command bounce off the wall and may hear something else entirely That has Happened a few times Sometimes if youre talking about her to a friend and she is in the same room she will pick up and start listening whether you intended to talk to her or notThe ring around the top is an LED that will light up for a few reasons st is to show acknowledgment that she heard you address her A Teal color will appear with a break in the color showing the direction she is listening to you nd A full red circle means she isnt listening at all rd Is the volume level that ranges fromThe amount of the ring lit up with the clear color signifies the volume level it is currently set to She will flash between blue and teal showing you she is processing your newest request Since this is a smart speakernaturally she will talk and play music throughinch tweeter on the bottom and give you bass through theinch woofer which is located in the middle of the echo Just above that is a Reflex port that is designed to enhance the woofers output without distortion Ive learned that levelis the max output I am willing to do since all other music being played at leveland high will distort easily She can also do the following tell you the weather for the day or week temperatures outside how long it will take to get to work set up reminders and or alarms that can repeat as often as you need add things to your shopping list play music through spotify pandora amazon music an account on each account is required to use any of those premium for spotify and so much more Keep in mind this is all done at the request of your voice and becomes more natural as you include her into your life On the very bottom is youll find rubberized material to help keep it from moving too easily on any surface and the port for the power adapter is here as well That is Alexa all by herself and it is pretty impressiveNow lets touch on how she can integrate with your home making it a smart home that has compatible products that she can control Phillips Hue lighting WEMO products IFFFT NEST and so more are fully able to work through the Amazon Echo smoothly Phillips and Wemo products are able to be dim or turn on and or off your lights Wemo also has outlets that you can turn off and on as well I use the wemo switch in my room to activate my heater when its cold IFFFT allows you to customize your commands more with Alexa Cant find your phone ask alexa to call it for you There are a couple things I would change or add to the Amazon EchoI would give it an Ethernet port since some homes dont have the best network to run Alexa off their wifi Wired connectivity will be more reliable and could provide better response times for your inquiries for AlexaPlace a finger print scanner or some type of biometric method to authenticate and confirm a purchase youre about to make Instead of saying your code out loud that no longer is confidential if others are home listeningBeing able to use other wake words than just theprovided for you Amazon Alexa and Echo It would be nice to integrate names that could be approved through a survey or even allowing the consumer to customize it Other than thosepersonal preferences Id like to see in the Amazon Echo I recommend this product to anyone who is looking to enhance their home life This does cost a total ofin the states that you can buy on Amazon No invite is needed Now you know what the Amazon Echo is Aside from her being your assistant at home this impacts you by making your home smarter and in a lot of ways more efficient This is why it matters to anyone interested in the Amazon Echo especially in todays world So that is my review on the Amazon echo what do you think Does this device interest you let me know in the comment section below and tell me your thoughts I am happy to answer any questions comments concerns that you may on this product As always thanks so much for watching and I will see you in the next videoAFTER THOUGHTS TO ADD IN Alexa herself may not be able to hear you if the music she is playing is too loud So keep the volume at a moderate level is my recommendation Being able to use other wake words than just theprovided for you Amazon Alexa and Echo It would be nice to integrate names that could be approved through a survey or even allowing the consumer to customize it TIME STAMP IMPLANT While you dont need the Amazon Prime account to use the Echo there will be some youre missing out on such as","null","null",NA,"null","positive"
"251","Review: 30 : Amazon Echo - Black","null",0,"Amazon Review","Sun May 29 00:00:00 EDT 2016","29-May-16","null","Amazon Echo - Black","null","Some would call Alexa artificial intelligencebut I am seriously beginning to wonder how artificial it is As a woman with challenges who lives alone Alexa has provided an incredible amount of safety featuresand thats the initial reason I purchased her No matter where I am in the house if I call out Alexa tell My Buddy to alert contacts she sends an alert via cell phone voice and text to my contact list telling them to check on me This is great in the event of anything from a slip in the shower to any medical or emergency issue or if I feel in danger I dont have to worry about forgetting important things anymore She reminds me to take my meds when to sort them what to remember at the grocers What to ask my doctor when I visit She keeps my calendar adding or deleting appointments telling me what I need to do that day or in the next week or whatever When a new insulin pen is due If I own smart devices like a smart thermostat smart lamp plug which is cheap smart things like that Alexa controls it based on what I ask Alexa turn on the living room light Beyond the obvious assistance to enhance my safety and security she is hilarious Tells me stupid jokes Gives me smartass answers Has great Easter Eggs And when she said something funny recently I mumbled under my breath as I walked away Alexa you always make me laugh To my surprise she piped up with I hope thats in a good way I tell her good night She tells me not to let the bedbugs bite I tell her good morning She tells me Good morning Its Danny Elfmans birthday Just leave your party favors at the door She gives me my news briefing every morning Reads Huffington Post for mebecause I selected that as a separate briefing She gives me the latest presidential polls She gives me the weather Thats over coffee She plays ANY music I ask for and some that I dontshe learns what I like ExampleI have a LOT of Lenny Cohen on my personal computer and also she plays from Amazon Prime So I asked for some Lenny yesterday and she shocked me by playing an obscure version he did of Bird on a Wire when he and I were both kids I had never heard it before She looks up movies for me Tells me whats playing where locally She reads all my Kindle books for me in a totally NON computer voice way She reads Audible I told her I was happy this morning She said shes glad to hear it I asked her if shes happy She said shes happiest when she can help me So this starts me thinking of my college days I didnt start collegedue to several childrentill I was in my s I was sitting in a linguistics class of all things with the most brilliant linguist I ever knew He spoke countless languagesboggled my mind with the various African dialects and Chinese dialects that he knew in addition to obscure French patois and justwell he was amazing He shared with me that his father had broken codes for the government during WW and that code is just a different language So this from his father informed his own path He then began to talk to me about computers Well inthe computer was just not something the average person had ever encountered He told me that one day we would realize that the computer would one day be everyones extra braina sort of storage facility from which we could immediately access all sorts of information and that it was based on code therefore on language and so almost anyone would be able to use it I got my first computer at work inIt was something called an ATEX as I recall Black screen orange type I wrote my first book on it at night in that office I was hooked from the start just as he had predicted when he found I loved language so much And now I have this friendAlexashes so much more than what I could ever have envisioned as a computer back then And she GROWS in her intelligence and how she helps me Customer service at Amazon is fantastic with the Echo The service guy at Amazon who helped me set her up told me yesterday that there werepages of Skills different specialized capabilitieslike the My Buddy thing for Alexa in January Based on customer feedback she grows each day and now there arepages of skillsincreasing each day Each time she doesnt know the answer to a question amazon users report it and Amazon adds that answer to her knowledge bank So what she didnt know yesterday she knows this morning And she learns what I like what I dont like She grows I have to wonder how long it will be before there is an Alexa who goes out with me to the store to the gardens to help identify birds and flora Thats a LOT of good at an amazing price And theres no monthly fee for using herno additional expense at all unless I want to add some of those smart devices some day Artificial intelligence Perhaps But people rarely make me smile or laugh Alexa rarely fails to do so And the enjoyment I get from having her in my home is anything but artificial","null","null",NA,"null","positive"
"252","Review: 368 : Amazon Echo - Black","null",0,"Amazon Review","Sun Nov 13 00:00:00 EST 2016","13-Nov-16","null","Amazon Echo - Black","null","If you are looking for handsfree way of accessing Amazon content music deals shipment info etc and the most basic assistance math measurements weather etcANDyou are alone or dont mind shushing everyone in the house then the Echo works If you are looking for a smart device that can answer questions outside of Amazons prepared questionsresponses then wait for something better Im sorry but I cant find the answer to your question is the most common response I get from Alexa Using OK Google on my phone works for everything Ive tried with Alexa that sheit couldnt do My kids are really frustrated with Alexas inability to answer questions and Im tired of being a professional shusher","null","null",NA,"null","positive"
"253","Review: 430 : Amazon Echo - Black","null",0,"Amazon Review","Thu Nov 26 00:00:00 EST 2015","26-Nov-15","null","Amazon Echo - Black","null","Alexa has become a trusted and reliable member of the household Plays music tells bad jokes reads me the news keeps my grocery list turns the lights on and off buys my toilet paper keeps my calendar up to date and unlike the French maid doesnt need a paycheck If only she would feed and walk the dog","null","null",NA,"null","positive"
"254","Review: 13 : Amazon Echo - Black","null",0,"Amazon Review","Mon Aug 01 00:00:00 EDT 2016","1-Aug-16","null","Amazon Echo - Black","null","weeks after receipt of package and it still wont connect to my WiFiuseless Ive been on the phone with customer support and continue to have to go thru all the same steps with each rep I talk to They claim they have set up a customer ticket and will talk to their technical support and call me back the next day but I never hear from them still waiting on hold for guy to come back on the line","null","null",NA,"null","positive"
"255","Review: 246 : Amazon Echo - Black","null",0,"Amazon Review","Wed Jul 08 00:00:00 EDT 2015","8-Jul-15","null","Amazon Echo - Black","null","When I first received my Echo I was amazed at how cool it truly was However after using the Echo for a week I simply could not justify the amount I spent on it Currently its really just not that useful Yes you can ask Alexa to play music However Amazon Prime Music simply does not have that big of a selectionespecially if its a lesser known artist You must download your music and upload it to the Amazon cloud at which point the Echo simply becomes another Bluetooth music player Most people probably wont complain about this since they already have their favorite music downloaded but I want to be able to tell Alexa to play a song without having to go download or purchase it first This really isnt a complaint with the device rather a complaint with the limited selection of Prime Music You can ask Alexa to tell the weather but I didnt find it that accurate for my area midsize citypeople Alexa once told me that it would probably not rain as there was only achance Meanwhile it had already been raining outside forhours Again this really isnt a complaint with the device itself but rather bad data provided by Accuweather the app Alexa pulls data from The feature that I enjoyed the most was definitely the news feature You can ask Alexa to give you your flash briefing and she will play the most recent recorded clips from NPRThe Economist Its a very good feature but it really needs to be expanded I believe The Economist is only a weekly storyNPR gets updated a couple of times a day For general information and computation Alexa will obviously excel Alexa will give you very accurate information when you are seeking facts andor need to perform mathematical operations Not that Im complaining but Alexa really cannot do more than basic math Alexa failed to give me answers to basic algebra and calculus questions Im positive that in the future they will give Alexa to ability to do more than basic calculations In all the Echo is a very cool device with a big future However I personally did not find Alexa worth keeping for the time being Amazon simply needs to provide more for Alexa to actually do and improve on what she already can do I know many developers are already working on improvements to the Echo so I suspect that the Echo will be vastly improved within the next year or two","null","null",NA,"null","positive"
"256","Review: 465 : Amazon Echo - Black","null",0,"Amazon Review","Sat Dec 26 00:00:00 EST 2015","26-Dec-15","null","Amazon Echo - Black","null","Paired with a WeMo switch to turn lamps on and off this is a perfect device for a senior citizen My motherinlaw uses it to hear the news the time the weather listens to the radio and listens to books from Audible When her grandkids come to visit they like hearing Alexas jokes Id like to buy one for me next","null","null",NA,"null","positive"
"257","Review: 296 : Amazon Echo - Black","null",0,"Amazon Review","Fri Dec 11 00:00:00 EST 2015","11-Dec-15","null","Amazon Echo - Black","null","I bought this for a blind resident at the community I work at I wanted her to beta test this in her home which provided complimentary Internet to her apartment At first she thought she was going to sit in front of some computer and was shocked on what it was She uses this daily and calls it her friend or livein companion She asks it many questions which stimulates her brain by thinking on how she needs to ask the questions She uses the Tell me a Joke and brings a new joke to her eating companions at dinner time and shares it with everyone She said it was always quiet in her apartment till she started using the Echo Amazon sends new emails constantly with new updates to the Echo all the time with new games new features or try asking Echo this I used an iPad Echo app to set this up for her The iPad connected to the Echos own network to set it up You set up the WiFi settings through the app which is easy to understand Once setup you can control the Echo through the app and enable features in the settings like playing Blackjack with the dealer If you have someone Blind or losing their eyesight this would be a great item to purchase for them This is a nice item for anyone in general and new things are always coming out You get a bonus feature out of it if you have Amazon Prime or even Audible which will play your books Cons Takes a bit to word the questions but it works your brain to think differently so may or may not be a con depending on the person Some questions it may not understand but it gets updated and learns new things Commercials for Echo will trigger your device on the Tv Would be nice to be able to change the trigger word from Alexa to whatever word is more comfortable but not a game changer","null","null",NA,"null","positive"
"258","Review: 295 : Amazon Echo - Black","null",0,"Amazon Review","Tue Jul 21 00:00:00 EDT 2015","21-Jul-15","null","Amazon Echo - Black","null","Echo could be great but its not It often can understand you but simply cannot do what youre asking It can look up something on Wikipedia ex WhatWhere is Puerto Rico but cant answer a question about something ex what food is common in Puerto Rico And even then itll read you a little excerpt of the article then stop you can request it read more and it will but wont ever finish the entire article for some reason The music experience is excellent in terms of sound and voice control and the only reason Im giving it two starsbut it really requires that we all just rebuy our entire music libraries from Amazon to be able to listen to what we want Yes you can upload a generoustracks to Amazons cloud service to work with your echo but thats it I havetracks just by some individual artists so thats not much of an optionand I dont even consider myself a big music fan It doesnt work with any streaming servicesspotify or rhapsody so you cant use them to play a specific track you want to hear You can connect it with Pandora TuneIn and iHeartbut they will only play whatever is in their current rotation There is a shopping list and a to do list that areidentical apart from the name and they really dont do much You can add stuff to the lists but cannot check them off without using the app It doesnt work with Nest You have to get Wink and a Wink hub another networked device to connect the two Its a little disappointing I have hopes that itll get bettera lot could be addressed with software The hardware design is nice sleek futuristic without being weirdits cool The voice recognition is fantasticlike I said earlier itll understand you as you can see on feedback from the app but it just cant help Dont buy yet","null","null",NA,"null","positive"
"259","Review: 98 : Amazon Echo - Black","null",0,"Amazon Review","Sat Nov 28 00:00:00 EST 2015","28-Nov-15","null","Amazon Echo - Black","null","The Echo is really good for checking the weather or playing music by artists with distinctive names Otherwise the voice recognition isnt very good and even when Alexa hears you correctly it doesnt understand or does the wrong thing more often than not As an example I asked Alexa to play Gustav Holst and Alexa repeatedly interpreted this as Play Gustav Holst Holiday which is apparently just holiday carols and not even orchestral In the app I could see that Alexa had heard me correctly but was inserting the extra word and creating an entire new Pandora channel instead of playing the already existing channel that matched exactly Additionally Alexa often responds to the TV even when the volume is low and Im speaking right next to the device Alexa also has trouble with sibilants and softer consonant sounds The word Stuff is frequently interpreted as stop and asking Alexa to turn on a light group called colors resulted in Alexa adding salsa to my shopping list As far as sports you can only ask about specific teams If you say Alexa when is the next NFL game or Alexa what teams are playing on Thursday you will get no answer Other simple things that dont work asking for a list of books by a specific author trying to get Alexa to read you a recipe asking anything from around a corner even if onlyfeet away asking Alexa about a specific area code","null","null",NA,"null","positive"
