"","ID","URL","Type","Corpus","Date","Dateline","Place","Topic","Title","Body","Notes","Snippet","Context","Summary","Sentiment"
"125","Review: 231 : Amazon Echo - Black","null",0,"Amazon Review","Wed Jun 15 00:00:00 EDT 2016","15-Jun-16","null","Amazon Echo - Black","null","Doesnt use Google crappy bing isnt intuitive doesnt do anything I need that my phone with Google voice doesnt do better only really special if you use smart home devices almost everything has to be entered through the app not useful to me Answers I dont understandof the time Made me realize what I really wanted was Google Home cant wait for it to come out later this year Im a Huge amazon consumer love my kindles order everything from Amazon But this product was just a big waste of money to me Sad","null","null",NA,"null","positive"
"126","Review: 25 : Amazon Echo - Black","null",0,"Amazon Review","Mon Oct 03 00:00:00 EDT 2016","3-Oct-16","null","Amazon Echo - Black","null","I have had an Echo since the Beta testing phase I hate the thing so bad It never gets request right unless its myyear old niece asking how many legs a cow has It never gets music request right from my playlist It never answers the most basic questions like what time is it It just gives the default Da Donk or Im sorry I dont understand the question I speak English as spoken in the southern USA not some weird garbled variation as a rd or th language I understand meta tags used in the process by the programs fetching the information served up by the Echo This thing makes me so freaking mad it is the bane of my existenceThe voice recognition algorithms and whatever form of predictive Ai is being used needs to be refined before they clutter the OS up with more useless features They need to get what they have functional Did I mention that I hate this freaking thing so very very bad and wish I had never bought it An example is if I want to play some music from my Amazon Playlist Frank Sinatra I cant say Alexa please play Frank Sinatra from my playlist and have it work NO OH NO no no no no You have to say Alexa my playlist play Frank Sinatra play my playlist play Any other variation of wording will get Da Donk or some other music like the Beatles or Seasick Steve Both of which I like but did not ask for Natural sentence structure is not usable with this device You cant askAlexa what is the weather for tomorrow Nope you have to say Alexa weather my location weather forecast weather weather tomorrow Who the crap programs the fool thing to require this type of syntax Seriously Jeff Bezos should be ashamed to have put out such a poor device and backed it up with an absolutely nightmare piece of programing My opinion is unless you are a cryptographer with the patience of a saint you should run screaming in the other direction instead of buying this device A potato would work better Digging out your own spleen with a dull spoon is a more rewarding experience","null","null",NA,"null","negative"
"127","Review: 315 : Amazon Echo - Black","null",0,"Amazon Review","Sun Mar 13 00:00:00 EST 2016","13-Mar-16","null","Amazon Echo - Black","null","Ordinarily I wouldnt have considered the expense of the but we recently moved to an area where the available selection of local radio stations just didnt cut it when it came to providing ambient music that we liked Since we didnt want to dedicate one of our computers to providing music I started looking at the idea of Echo After reading so many glowing reviews that pointed out how well it worked and how versatile it is I ordered one When it arrived I set it up without much problem I was able to connect it with Pandora iHeartRadio tuneIn and my Amazon Prime musicI uploaded the iTunes music on my computer so I would have access to it as well Being able to add to to do and shopping lists and have the results interact with the Alexa apps on our phones is definitely handy Being able to set a timer for when to take the meatloaf out of the oven by simple voice command is practical as well as handy Being able to find out the weather traffic and have access to a number of sources for information about a great number of subjects without having to sit down at the computer is very helpful I havent felt the need to automate my lights appliances and thermostat yet Now that Ive said that it more than meets my needs how well does it respond to what I instruct it to do Excellently The only time it doesnt understand me is when I have a piece of music with a long title like a symphony with four movements on separate tracks Its speech recognition is excellent but it doesnt read minds The range at which it can respond to commands is excellent I can give it commands from the bedroom almostfeet from the kitchen where it is locatedwithout shouting There are some petty annoyances My music which had been set up in iTunes was successfully uploaded to Amazon with its music app and that included the playlists I created in iTunes The problem is that while AlexaEcho recognize playlists specifically created using the music app but not the ones imported to Amazon Music from iTunes Ive no idea why For people who have computers that are not WiFi equipped but have a WiFi access point the setup instructions to go to your computers WiFi settings dont apply It is far easier to use the Alexa app on your phone Once past the point of recognizing Echos WiFi you can use your computer for everything else One last thing a wish It would be nice to be able to connect the Echo to my home theater sound system for serious music listening","null","null",NA,"null","positive"
"128","Review: 83 : Amazon Echo - Black","null",0,"Amazon Review","Wed Jun 24 00:00:00 EDT 2015","24-Jun-15","null","Amazon Echo - Black","null","Echo doesnt do much and much of what it does it doesnt do well For instance playing music A couple of nights ago I was working out The Echo was in the room I said Alexa play the album How Long Has This Been Going On by Van Morrison It began playing the song How Long Has This Been Going On This song is on the album but its not the first song so I suspected it was just playing the song To test this I said Alexa play the next song to which Echo replied There are no other songs I know there areother songs on the album So I tried it again this time stressing the word album and got the same result So I went to the Echo support site and looked up what I was supposed to say to play an album and saw that I in fact had given the proper command I decided to try another album named after on song on that album Same result Do you know how many albums this applies to A lot and guess what Echo wont play them Then theres the Wikipedia feature I used the command Alexa Wikipedia and then gave it a topic What Echo returns is a brief one sentence description of the topic followed by instructions for me to go to the Echo application and read more If I would have wanted to go to the computer to get the information I would have gone straight wikipedia without messing with the Echo One thing I do like is I can just say Alexa set an alarm forAM and it will set the alarm So I was thinking that since Echo has access to my full music collection and an internal clock capable of scheduling events I would have it play a song at a certain time and use that as an alarm Thats what I get for thinking Echo doesnt do that Echo holds the promise of being a very cool device that would be very fun and useful to own but it fails to deliver on that promise The hardware is nice The speaker sounds good but it just doesnt do that much Im interested in and I find myself wishing it would do more I own a Kindle Fire and have had a world of trouble with Amazons Silk web browser Unfortunately thats the only web browser in their app store so Im stuck with it Im just not convinced Amazon is competent to write test and release quality software for the devices they produce If Echo is the kind of thing youd like Id suggest keeping an eye on competitors and buy a similar device from them Ive had my Echo for a few months now and its getting better so Ive raised my rating from one star toIts still frustrating at times but now the fun out weighs the frustration The voice recognition is getting better and features are being added daily I find myself swearing at it a lot less In fact I found myself wishing that it wasnt limited to one room and could use it all over the house and on my deck without having to carry it from room to room Im looking into how I could make that happen","null","null",NA,"null","positive"
"129","Review: 70 : Amazon Echo - Black","null",0,"Amazon Review","Tue Mar 08 00:00:00 EST 2016","8-Mar-16","null","Amazon Echo - Black","null","Well what can I say I took the plunge and bought one of these and I gotta say Im glad I did Does the usual things timers weather and orders pizza yada yada I mainly got it to control my Hue lighting system in my apartment and turn my wall mount air conditioner off with a Wemo switch All of that it does flawlessly without a hiccup I also use it to interface with thr Harmony remote using IFTTT to turn on av equipment Sometimes that can be a laggy but thats not Alexas fault and seems to depend on the time of day faster during the morning and afternoon slower tonight No supprise there Just hoping and waiting for the day when we can change the wake wordhint Looking forward to seeing how this product growsNow the down side Granted it has nothing to do with the echo itself but how it was shipped Package only had one small pack of plastic protection on one side of the echo Even then one of the sections was popped Not enough packing material to keep the echo from banging around inside the shipping box Had visible damage on two corners of the echos actual box All in all a very poor way for Amazon to ship their flagship toy Not to mention the dents in the corner ruined the unboxing experience that I had been looking forward to this item was on backorderin addition wondering if the unit was damaged all along while opening the box Please fix that Amazon I dont want to go through that again with the DOT that I just preordered","null","null",NA,"null","positive"
"130","Review: 483 : Amazon Echo - Black","null",0,"Amazon Review","Tue Jul 14 00:00:00 EDT 2015","14-Jul-15","null","Amazon Echo - Black","null","Super FUN and AWESOME device I got it today and been using it literally the whole day Lol Im a smart home homeowner and very techy guy All my lamps in the house are all connected to Wink and are all controlled through my phone When I ordered Echo Wink wasnt a feature at that time so I was hoping it will and finally today when I got my Echo I was very surprised and very very happy that I am able to access my Wink Hub through it Super fun and smart Love listening to music and asking Alexa questions I hope in the future Amazon will also be able to access other Wink products in the house to doors thermostat alarms garage etc But for now just say Alexa Kuddos to AMAZON too bad I cantI dont know how put a video on this review","null","null",NA,"null","positive"
"131","Review: 179 : Amazon Echo - Black","null",0,"Amazon Review","Mon Aug 31 00:00:00 EDT 2015","31-Aug-15","null","Amazon Echo - Black","null","First and foremost the hardware for the Echo is a sweet spot for the pricerange it fills every living room Ive brought it to and its sound reaches quite a few yards when utilized outside however the Bass drops out when theres nothing but open air Overall audio becomes distorted if used at max volume indoors once again outside seems to suffer less despite the bass dropout For voice recognition the Echo and its assistant Alexa are just about on par with Google and Apples assistants To date Ive only found way to reliably trip up Alexa and thats by playing a song named after an artist Telling Alexa to Play Marvin Gaye feat Meghan Trainer by Charlie Puth willtrip her up because she seems to fail at analyzing the sentence structure The Echos audio sensors also struggle to hear voices indoors when playing at highvolumes Id recommend keeping the remote on hand for parties Or Ragers for you rad types as it can be used to talk to her and quiet her without having to yell over that crazy bash youre hosting for your yrold uncle you dirty dog you The Echo is also a forefront for home control I havent bothered linking lights to it just yet because the technology is still pretty expensive to set up the entire home The partnership with IFTTT IF This Then That is great for keeping controlfeatures open ended Lastly the biggest challenge for the Echo and Amazons Prime Music is finding that happy medium of importing songs you previously own Its possible but you have to pay year if you plan on importing a library of any substantial size This is important if you need to blast your NoDoubt albums to appease all your cool hipster friends because youre countercountering counter culture Overall a solid buy especially if you can get it on a discount day Not for audiophiles but great for the regular human being with a soul","null","null",NA,"null","positive"
"132","Review: 16 : Amazon Echo - Black","null",0,"Amazon Review","Wed Aug 05 00:00:00 EDT 2015","5-Aug-15","null","Amazon Echo - Black","null","This thing is awesomebut have you guys seen the sleeve for the echo It is the bomb and changes the color by just slipping it on Check it out","null","null",NA,"null","negative"
"133","Review: 58 : Amazon Echo - Black","null",0,"Amazon Review","Wed Oct 05 00:00:00 EDT 2016","5-Oct-16","null","Amazon Echo - Black","null","I love Alexa She gets the news for me in the AM while I have tea she tells jokes she plays games like name the state capitals or name the movie She is my timer when I need one I can get the weather or the time from anywhere in the world She gives me traffic reports I can increase or decrease the volume by voice commandask the name of the artist that is playing skip the artist that is playing repeat the song or start over if you missed the beginning or just want to hear it again A feature that I use a lot is she has access to Wikepedia so you can ask her virtually anything you would want to look up there and give you a summary then ask if you want to hear more Just like a human she occasionaly mishears a word you use but you can tell her to stop and then you repeat the sentence and the quality of sound is very good I have my Echo in the kitchen side of the house but can hear her where ever I go in myBR house must say I am impressed I have had the Amazon Echo formonths","null","null",NA,"null","positive"
"134","Review: 497 : Amazon Echo - Black","null",0,"Amazon Review","Wed Apr 20 00:00:00 EDT 2016","20-Apr-16","null","Amazon Echo - Black","null","I hooked up my whole house with GE Zwave light switches Now with voice activation i can control all my lights at the house My kids theyre young use it to verify homework my wife doesnt ask me for the weather every day she asks alexa and equally important shes now asking her about the news Also during breakfast the kids ask her to play kids music she shuffles a bunch of kids music into a play list from prime and plays it At night during dinner we ask her to play jazz or classicalonce i hookup my blinds and other stuff around the house to my smartthings hub im going to be able to control everything with voice Now if only she could start cleaning up after the kids","null","null",NA,"null","positive"
"135","Review: 408 : Amazon Echo - Black","null",0,"Amazon Review","Thu Jul 07 00:00:00 EDT 2016","7-Jul-16","null","Amazon Echo - Black","null","I purchased an Echo Alexa in lateas a family Christmas present I wasnt sure what to expect going in but my family and I love her Weve used her daily since we set her up on Christmas Let me start off by saying that Alexa is at times about as smart as a toddler Her IQ seems to vary dramatically depending on what youve asked her I do love that she can hear me from very far away but at times she doesnt understand what Im asking Now that Ive learned how to speak to Alexa she normally does exactly what I ask I love that you can do more than just play music with this device I reorder items on Amazon ask questions about measurements while baking and of course she reads my EBooks to my while I cook The only major flaw that I see is that occasionally she only seems to pick up a portion of my question I think Alexa is definitely worth every penny and I will be purchasing another one for my family this year","null","null",NA,"null","positive"
"136","Review: 456 : Amazon Echo - Black","null",0,"Amazon Review","Mon Mar 14 00:00:00 EDT 2016","14-Mar-16","null","Amazon Echo - Black","null","The concept itself is amazing with huge potential however its Quickly becoming a sad excuse for a trivia box I check for the newest skills which is just a fancy name for apps quite often to find mostly stupid individualized nonsenseWhile that may prove to be a nice gimmick for some there are still many issues that need to be addressed for the echoes usefulness Its being marketed as a personal assistant and in my opinion that is where its lacking the most It can take messages notes shopping list etc But has no way of getting that information back to you When an alarm or timer goes off you better remember why you set it or you will have to go looking in the app for that info when echo could have simply read it back to you with a simple app A simple app could enable the echo to email text or even Skype any relevant information making it way more productive as an assistant If Amazon engineers want the echo to be a huge success and not turn into the next fad flop I would suggest starting with inexpensive android watch and attempt to meet or exceed its functionality which is leaps and bounds ahead of the Amazon Echo I guess I should conclude this by saying I do not hate the Amazon Echo I actually love it and do not wish to see it fall between the cracks with all of the other latest and greatest gadgets because of a few missed opportunities I only gave it one star because most people read the best and the worst skipping everything in betweenSo heres to hoping Amazon engineers get the message","null","null",NA,"null","positive"
"137","Review: 254 : Amazon Echo - Black","null",0,"Amazon Review","Thu Jun 16 00:00:00 EDT 2016","16-Jun-16","null","Amazon Echo - Black","null","Dont buy oneI ownof these devices and they used to work fine No more If playing music at any level and you ask the device to do something it no longer mutes the music listens and then responds to the command as they all used to do I should qualify this in all candor by saying that is the music is down really low and you yell it may still work I yell at mine all the time now Thanks Amazon","null","null",NA,"null","positive"
"138","Review: 355 : Amazon Echo - Black","null",0,"Amazon Review","Fri Jul 22 00:00:00 EDT 2016","22-Jul-16","null","Amazon Echo - Black","null","Bought it with my Prime MembershipWhat they never tell you anywhere on the purchase site same with your Prime Membership the apps for Alexa and Prime Music will not work outside of the USAApp not available in your country Amazon accepts International Credit Cardsbut will not warn of country incompatibilities until you receive the item VERY pissed off Now I have to invest in a DNS server subscription just to SETUP Alexato fool her into thinking I m in the USotherwise she is of no use to me Will probably relinquish my membership to Prime and sell my Alexa to someone heading to the USA if Im lucky","null","null",NA,"null","positive"
"139","Review: 51 : Amazon Echo - Black","null",0,"Amazon Review","Sat Jun 20 00:00:00 EDT 2015","20-Jun-15","null","Amazon Echo - Black","null","I bought Echo as a gift thinking it was a tech toy It is much more When I want to know the weather I ask If I wish to listen to Pandora or Amazon music all I have to do is say sono turning on a device to do so There is a slight learning curve on how to ask questions The timer feature is also handy Alexa is also programmed to respond to thank you with several appropriate responses I admit that we purposely try to stump her with questions There are some that she says she cant find an answer however if the question does not require logic to answer most can be found Wikipedia is handy for many Radio also works well I am still learning how to get the station I want by phrasing the question properly I have not ordered any products from Amazon as recurring purchases yet The phone app is helpful for customizing Echo and contains the history of questions asked It also checks to see if the device understood correctly It is a useful device to add to my connected home I would recommend it for anyone who wants a piece of easy to use technology that will quickly become part of your home environment It also has a remote control","null","null",NA,"null","positive"
"140","Review: 290 : Amazon Echo - Black","null",0,"Amazon Review","Thu Jan 07 00:00:00 EST 2016","7-Jan-16","null","Amazon Echo - Black","null","Man that was a frustrating purchase I so wanted to love it Got it up and running easily but then the kids got involved We havehigh school and middle school kids The questions started flying at Alexa My wife and I went nuts hearing her ask them to repeat the question or that she didnt know the answer Animals math songs people geography sports homeworkit didnt matterof the questions were not answerable Even as a music player it is frustrating to hook up so many different phones and playlists The only things it did well were play the last Pandora station and NPR Everything else is handled much better with Google and a smartphone Really cant recommend this unless you have a specific need that it can handle","null","null",NA,"null","positive"
"141","Review: 52 : Amazon Echo - Black","null",0,"Amazon Review","Sat Jul 11 00:00:00 EDT 2015","11-Jul-15","null","Amazon Echo - Black","null","I purchased my Amazon Echo just last week I think Im in love Things Alexa does that make me SO happy integrates with my Phillips Hue system smart lights So time for bed Alexa turn off the bedroom lights Me Alexa good light Alexa good night sleep tight me play music Alexa picks me play classical music or play pandora or play Carole king or tapestry or my playlist turn volume upvolume downvolumeI listen to audible audiobooks in the car Last night I just asked Alexa to play my audiobook and viola right where I left off Pause continue stop backsec etclove news briefs Wikipedia weather traffickers sports scores shopping lists word definitions measurements when cookinglove the jokes and surprising answers with WINK you probably could have her control thermostats and garage doors What Do I Wish for I want to be able to name her Hal or computerI want to be able to linkechoes together so I can communicate with her from multiple rooms or have my music play throughout the house integration with my phone to send texts call someone receive calls and textspolitely excuse me Linda you have a call from your boss are we going to take it Or should I just take a message conversational history eg When was jfk born when did HE attend high school music timer play Bach forminutes then fade universal remote features harmony remotes pay attention to integrate my audiovideo and TV equipment I could put a wiMo switch on it but not so elegantor wise I want her to be able to read my iOS calender she does integrate with google cal so you probably can figure that out and remind me of appointments or birthdays during my morning news briefings But with all these wishes I still love what she can do TODAY and shes well worth the price I think I will be buyingeven without the integration PS people complaining that you have to plug it in are missing the point Always on always listening is what makes ECHO great If you want portableuse Sirii can see a need for extensions for ECHO but always listening needs constant power Even hands free Siri only works when plugged in ECHO is more like the computer from Star Trek Except it cant make a cup of earl gray tea But maybe some day","null","null",NA,"null","positive"
