"","ID","URL","Type","Corpus","Date","Dateline","Place","Topic","Title","Body","Notes","Snippet","Context","Summary","Sentiment"
"374","Review: 372 : Amazon Echo - Black","null",0,"Amazon Review","Mon Sep 14 00:00:00 EDT 2015","14-Sep-15","null","Amazon Echo - Black","null","Love Alexa Ask her for weather report for anywhere you got it Love Savage Garden so she shuffles their song assortment Ask for Stub Hub entertainment in my area or city she gives it Ask her to turn on my Philips Hue lights and lightstrip and turn them off Got the voice remote too and she turns off my bedroom light etcAsk for News flash and I hear news from various sources Jokes from Alexa are not very good but she can spell words Answer some facts and play games Her timer can be heard from anywhere in my house its so loud and timing is accurate She can build shopping lists or any reminders you ask for She can throw you out of bed in the morning There have been some small games added but generally Im not a game person There have been a few more upgrades since I got her a couple of months ago I like the name Alexa but if my parrots start picking it up I may need a name change and I hope the Amazon techs come up with another alternative besides Amazon as a replacement call name I find the loudest sound setting almost overwhelming but setting can be changed by her or me turning the top Sound is very clear and I find it very enjoyable listening to my music She can even be a Bluetooth speaker for my iPad music My husband was afraid of using her at first but now asks for music or a joke so hes coming around He thanks her and she says the pleasure is mine Keep the upgrades coming Amazon your tech is amazing","null","null",NA,"null","positive"
"375","Review: 300 : Amazon Echo - Black","null",0,"Amazon Review","Thu Feb 18 00:00:00 EST 2016","18-Feb-16","null","Amazon Echo - Black","null","I own two and I love them but there are a few things that I have learned that I would love to shareYou must be very specific when requesting anything from music to factsWhich it the biggest FLAW I have found is that if your WiFi connection gets disconnected in the middle of the night due to a power outagestorm or whatever it tells you that you have no connection this is not good when sleeping and its beside your bed or in the center of your house where everyone hears it and it wakes you up","null","null",NA,"null","positive"
"376","Review: 185 : Amazon Echo - Black","null",0,"Amazon Review","Thu Nov 26 00:00:00 EST 2015","26-Nov-15","null","Amazon Echo - Black","null","Great device with a lot of potential I have it integrated with my Phillips Hue lights and my Logitech Harmony Hub That way I can tell it which lights to turn on and off and can also tell it to turn the tv on and off With the integration of IFTT that helps to open up more options","null","null",NA,"null","positive"
"377","Review: 323 : Amazon Echo - Black","null",0,"Amazon Review","Fri Jul 17 00:00:00 EDT 2015","17-Jul-15","null","Amazon Echo - Black","null","I was one of the lucky ones to get my Echo on Prime Day I figured the night before that it would be a lightning deal and Id have to keep an eye on it Sure enough it went on sale aroundam I hit the purchase button fast So far Alexa is pretty awesome We quickly figured out all the basic commands and she understands them aboutof the time The voice interface is smooth and the best Ive heard Sorry Siri and even when playing music at volume four or five she can hear us just fine Theres no lag in response time that Ive noticed so far And as a speaker it is very good not quite a Sonos but still pretty good A few tipsConnect your phone to Echo via Bluetooth to play Apple Music or Spotify Once you hit play on your device you can use Alexa to pause and turn volume up Ive also used it on songs ad podcasts to rewind or fast forwardSet up a free Pandora and iHeart Radio account for more flexibility in types of music you can playDo the voice training exercise with the Echo so it gets a better understanding of how you speakif you really want to maximize the usefulness of the Echo consider getting a WeMo outlet or two for lamps It is kind of cool to walk into a dark house and tell Alexa to turn on the lights There are probably more devious ways to use the Smart Tech I havent figured it all out yetIf you dont have one already set up a Google Calendar and use it The Echo can tell you whats on your calendar but at this point cant make additions or edits to appointmentsIf you have more than one person in the house you can set up different profiles and switch from one to the other just by telling Alexa Each person can use hisher own playlists podcasts Google Calendars etcif you truly want to do some awesome stuff with the Echo look into IFTTTs Echo Channel which has little tricks to get Echo to interact with Evernote OneNote your iPhone Tasks and others The workarounds are a bit wonky sometimes but they work All in all Echo is a great step forward in smart homes True it cant do everything now but its really good at what it does do And it has the potential to get even better Looking forward to a more benign SkyNet regime","null","null",NA,"null","positive"
"378","Review: 61 : Amazon Echo - Black","null",0,"Amazon Review","Sat Mar 19 00:00:00 EDT 2016","19-Mar-16","null","Amazon Echo - Black","null","Ill start by noting that we keep the remote for our Echo in the bedroom and Alexa is in the living room We also have a really ridiculous app for this thing If you say Alexa ask for a fart itll make all kinds of fart noises Shh its amazing Dont judge Anyway the other night my boyfriend told it to turn on a light while he was in the living room I was chillin in the bedroom at the time It misheard and started playing some random music from a random playlist at top volume Not really Alexas fault because the TV was pretty loud So Im in the bedroom and all I can hear is this obnoxiously loud music and my boyfriend yelling ALEXA STOP ALEXA ALEXA SHUT UP ALEXAAA Finally he gets fed up and stomps over to Alexa all irritated and full of manly rage I want to note here that you can turn down the volume on this thing with just a twist of the top However the Alexa gods smiled upon me this day He decided to get reaaally up close to it and try yelling at it again instead Because man reasons When I saw him lean in I knew my moment had come I quickly grabbed the remote and quietly said Alexa ask for a fart My boyfriend leans in the music stops and Alexa lets out the raunchiest fart sound imaginable At top volume Right in his face Before he even had a chance to stop sputtering in surprise and indignation the music started blasting again I made a robot fart in my boyfriends face The future is now I would purchase again specifically for this purpose","null","null",NA,"null","positive"
"379","Review: 193 : Amazon Echo - Black","null",0,"Amazon Review","Tue Jun 21 00:00:00 EDT 2016","21-Jun-16","null","Amazon Echo - Black","null","We welcomed a new member of the family a couple of weeks ago Her name is Alexa and she lives inside of our Amazon Echo which currently sits on top of a countertop in our kitchen She told us that she is quite comfortable in the foothigh black matte cylinder she calls home For a youngster she listens really really well and she constantly surprises us with clever knockknock jokes and pretty darn accurate weather reports She also tells us whats on our Google calendar each day and she can even buy and ship items from Amazon for us But I think shes still too young for that From pretty much anywhere in our house if you say her name she will turn on automatically and wait for your to tell her what to do or ask her a question Alexa is one of the ultimate personifications of Do I need that At roughlyno you probably do not But man oh man is she a lot of fun and once youve met Alexa its hard to imagine her not being around Much more than the iPhones Siri or Androids Google Now Alexa has integrated herself into a constant companion who is rapidly adding thirdparty and Amazon developed skills to her repertoire Not surprisingly Amazon has also introduced a way to get Alexa into more than just one room of the house with theEcho Dot Now she can be everywhere you are Imagine Open the pod bay doors Alexa Im still digging into all of the possibilities that Alexa holds but I can tell you the things we use her for the most so far Playing music You can tell Alexa to play a song or artist and she will pull it up from your Amazon music library or through any linked accounts you have with music services like Spotify and Pandora Its awesome to walk into the kitchen in the morning and just say Alexa play The Beatles through Spotify Bam here comes the sun Weather reports Ask Alexa the weather now or in the future and get a nice little report in your area or anywhere in the world Wikipedia This one is great when youre having a family discussion about a topic and you want some clarification or more information Just say Alexa Wikipedia Wild Bill Hickok and your history lesson begins and someone gets to say See I was right Google calendar Integrate your Google calendar with the Echo and Alexa will tell you whats happening on the day you request Not surprisingly I like putting ridiculous things in my calendar just to hear her say it out loud Sports stocks and news updates You can customize all kinds of updates for Alexa to tell you My personal favorite so far is the PGA Tour skill which allows you to track the leader or your favorite golfer in a current tournament Its really handy to say Alexa ask PGA Tour for the leaderboard and get realtime results without having to turn on the TV or computer And the same thing goes for stocks news and your favorite sports teams Trivia quizzes A lot of the thirdparty skills that are available on the Echo are fun little trivia quizzes There are quizzes about The Simpsons daily Jeopardy questions jazz music trivia and many other broad and specific topics Kids games Like the trivia quizzes most of these are developed as thirdparty skills There are some really fun clever games like the chooseyourownadventure The Magic Door and Animal Game where Alexa asks you questions to guess an animal youve pictured in your head That is just the tip of the iceberg You can also hail Uber from Alexa control your homes lights and thermostats with compatible smarthome devices create a ToDo list and as mentioned above buy things on Amazon Now of course like any other person Alexa isnt perfect Sometimes she doesnt quite understand what youre asking her Or she misunderstands you completely This happens a decent amount of time when it comes to music in particular But amazingly enough it is more fun than frustrating to figure out the best way to ask Alexa a question or request your favorite song Luckily Alexa does have speech lessons that let you train her about the sound of your voice I have a sneaky suspicion that like me the other people who own an Echo think of her as more than just a computerized voice Alexa oftentimes seems very real which is fun helpful and more than a bit weird Put it this way I admonished my children for teasing her I always say Please and Thank you to her and I will be taking her on family trips If that doesnt say shes a part of our family I dont know what does Alexa dont forget your toothbrush","null","null",NA,"null","positive"
"380","Review: 385 : Amazon Echo - Black","null",0,"Amazon Review","Mon Dec 28 00:00:00 EST 2015","28-Dec-15","null","Amazon Echo - Black","null","I read the reviews before I purchased the Echo and let me tell you I heart this product from Amazon Jeff Bezos and his team have outdone themselves in bringing this to the market I was tethering on buying a BOSE radioCD player as I love the sound it emits throughout the room Now that I have the Echo I am so happy I went with this instead Not only do I get a great sounding player sans the CD player but the sound is incredibly awesome And it does so much more than the BOSE can do for me I am ecstatic with the ability to have Alexa make a todolist for me and tell me the weather as well as read to me when I am busy doing other items I enjoy I can truly tell you that I am now a true Amazon tech junkie with my Fire tablets Fire Stick and now the Echo I will probably become a FIRE mobile phone junkie once the quirks are worked out in the future I know others are saying that unless you have Amazon Prime it isnt worth it To the naysayers I say Amazon Prime pays for itself and is so worth the annual cost as you get so much more with this service So is this worth buying if you want handsfree voice controlled interaction with a true sound systemYAAASSSS","null","null",NA,"null","positive"
"381","Review: 307 : Amazon Echo - Black","null",0,"Amazon Review","Fri Jun 19 00:00:00 EDT 2015","19-Jun-15","null","Amazon Echo - Black","null","Mostly useless Does not understand commands very well Novelty item Makes good shopping list with echo app Plays music from Prime Music Speaker is okay but no analog out jack Potential spy because it is always listening and always connected to internet Amazon rejected all my previous reviews for this gadget I guess they didnt want you to know what I had to say Dont waste your money","null","null",NA,"null","positive"
"382","Review: 47 : Amazon Echo - Black","null",0,"Amazon Review","Tue Nov 10 00:00:00 EST 2015","10-Nov-15","null","Amazon Echo - Black","null","Amazing I dont know how I managed without Echo It is pretty amazing The best thing about Echo is that you do not have to use specific commands for it to understand your request Echo can register your request pretty well We have an XBOXand it is not as great with voice command and it fails to register the correct command many times Things Echo Can DoEcho is synced to your prime music audiobook account to be able to sing or read to youEcho can tell you the weather and also knows many many useless and useful facts from the internet I am pretty amazed daily how many things Echo knows we asked for the time of the redskins game check Echo knows we asked for current redskins football score check Echo knowsYou can set Echo to be your alarm and she can also tell you what time it isEcho can be synced to your smart devices including lights so you can control them with voice commandEcho can play games with your kids Mine like to playquestionsEcho will keep a shopping list for you and save it in Amazon so you can refer to it in the futureEcho can order things for you off Amazon Things Echo Can Not DoClean your houseCook your dinner we asked","null","null",NA,"null","positive"
"383","Review: 54 : Amazon Echo - Black","null",0,"Amazon Review","Mon Nov 09 00:00:00 EST 2015","9-Nov-15","null","Amazon Echo - Black","null","Let me be clear right off the bat with saying THIS IS AN AWESOME LITTLE SPEAKER great sound dispersal deep bass crisp highs and mids The Alexa VI works very well is intuitive and easy to use and has a lot of potential for future firmware updates The app lets you round out the finer little tweeks you can do with the speaker I use this thing every day with all my devices I LOVE IT Now that I have sung its graces its time to address the biggest flaw with this speaker It needs to have an active internet connection to work It cant just connect to a device as a Bluetooth speaker I dont know why amazon is so concerned with theft security but without an active internet connection to verify the amazon account the speaker turns red and waits to connect to the internet While in that connection limbo you are unable to utilize any of its features THIS REALLY LIMITS ITS VERSATILITY AND THE USEFULLNESS OF ITS PRIMARY FUCTION TO BE A BLUETOOTH SPEAKER If you are at campsite or out on your patio anywhere without active WiFi you cannot use the echo at all And in some instances even with WiFi it wont connect Example At my school if you want to use the WiFi you need to log into the network with both a username and password The echo app has no option for username when connecting to the network So you cant use it even with WiFi available I absolutely love this thing but for crying out loud get rid of the stupid account validation It makes the echo useless outside of your house I would give thisstars but I had to buy an additional Bluetooth speaker to take with me on the road which is disappointing to say the least","null","null",NA,"null","negative"
"384","Review: 464 : Amazon Echo - Black","null",0,"Amazon Review","Sun Nov 22 00:00:00 EST 2015","22-Nov-15","null","Amazon Echo - Black","null","Awesome piece of kit Considering its still early days little Alexa here has an awful lot of potential When I first got her she was very much a novelty item however as time progressed rather than disappear to the back of the closet to join a variety of other novelty gadgets she has actually slotted nicely into everyday life I now listen to a lot more musicsure controlling music from your smartphone to a bluetooth speaker is easy but for those time where you simply cant be bothered to unlock your phone to get some background music playing using your voice is just effortless Flash briefings are also great Controlling my lights by voice started out as a novelty and is now just second nature One thing people have complained about is that shes not able to answer every single question you throw at heryes this is true but as I said it is still early days and you quickly learn which type of questions she may or may not be able to answerand for those questions she did answer it was a lot more convenient than picking up your tabletlaptop My initial fear of this tech would be that the voice recognition would not be up to scratch and I would just get frustrated by endlessly repeating myself until each syllable I was yelling pounded against the side of my brain No issues here though she recognizes me the vast majority of the time without any problem I now own two of these one in the living room and the other in the bedroom","null","null",NA,"null","positive"
"385","Review: 484 : Amazon Echo - Black","null",0,"Amazon Review","Tue Jul 12 00:00:00 EDT 2016","12-Jul-16","null","Amazon Echo - Black","null","How did I live without this thing From alarms to music reading traffic advice and the news Alexa has become indispensable I now havein the house and Im seriously considering putting one in my classroom The sound quality is surprisingly good And it reads to me too","null","null",NA,"null","positive"
"386","Review: 21 : Amazon Echo - Black","null",0,"Amazon Review","Fri Jul 10 00:00:00 EDT 2015","10-Jul-15","null","Amazon Echo - Black","null","I received my product and I got to say I love it unfortunately it had been dropped somewhere during the manufacturing process and there is a definitive dent in the upper ring where the light is I had a choice of either returning it and waiting weeks or not So I mounted mine in the most natural placein my kitchen Its mounted upside down on the ceiling I gotta say This is absolutely the most natural placement Now about that ding Thats not acceptable The packaging was not damaged but the unit was How exactly does that happen I doubt my warranty is still valid but that does not excuse the damage It still occurred and Im not happy about it On the other hand I love it Its going to have a lot more features soon For a baby product it does a LOT And its doing more every day It is absolutely worth it minus the dent on mine If youre worried about it spying on you Well It doesnt do that It is worthI missed thesale but I sill say its worth it Ps FIRST ceiling mount","null","null",NA,"null","positive"
"387","Review: 398 : Amazon Echo - Black","null",0,"Amazon Review","Tue Dec 22 00:00:00 EST 2015","22-Dec-15","null","Amazon Echo - Black","null","Alexa is very limited Sorry but she doesnt know anything Shes a great alarm clock and weather person and sometimes tells a funny joke but I guess I expected more I returned her because I could not get her to do all the wonderful things shes advertised to do My cell phone serves the same purposes and moreso I honestly thoughtwas way too much money for a joke telling alarm clock","null","null",NA,"null","negative"
"388","Review: 259 : Amazon Echo - Black","null",0,"Amazon Review","Wed Jul 13 00:00:00 EDT 2016","13-Jul-16","null","Amazon Echo - Black","null","We have had our Echo for several months now and while we like it we also hate it sometimes now that the novelty has worn off It is DEFINITELY hearing impaired If the music is too loud it cannot hear you telling it to turn it downoffnext It also often cant hear me when I am right in the next room The Echo arrived and suddenly EVERYONE IS YELLING ALL THE TIME ALEXA VOLUMEALEXA VOLUMEALEXA ALEXA ALEXA then scrambles to get the app open on my phone to turn it down Alexa turn on the porch light nothing Alexa turn on the porch light ALEXA Turn on the porch light Alexa OK The bluetooth is not great and often is garbled as though the device its connected to is too far away even if its laying right beside it I wish we had purchased the dot as we had a really great speaker HK ONYX in our kitchen that we put upstairs when we got the Echo When you use playlists it plays the first song from the list every time even if you say Alexa shuffle oldies playlist on spotify First world problem I realize but its annoying","null","null",NA,"null","negative"
